{
  "$schema": "https://json-schema.org/draft/2020-12/schema",
  "$id": "https://owasp.org/dsgai/datasets/vulnerability_dataset/schema.json",
  "title": "DSGAI Vulnerability Entry",
  "description": "Schema for a single vulnerability entry in the OWASP DSGAI vulnerability_dataset. One JSON file per entry, validated against this schema.",
  "type": "object",
  "additionalProperties": false,
  "required": [
    "vulnerability_id",
    "title",
    "description",
    "affected_component",
    "dsgai_mapping",
    "severity",
    "source_urls",
    "date_added",
    "disclosure_status"
  ],
  "properties": {
    "$schema": {
      "description": "Optional pointer to the schema file for editor tooling (VS Code, JetBrains, etc.). Ignored by validators.",
      "type": "string"
    },
    "vulnerability_id": {
      "description": "Internal identifier. For CVEs use the CVE ID; otherwise use a slug like 'DSGAI-VULN-research-2024-indirect-prompt-injection-bing'.",
      "type": "string",
      "pattern": "^(CVE-\\d{4}-\\d{4,7}|GHSA-[a-z0-9]{4}-[a-z0-9]{4}-[a-z0-9]{4}|DSGAI-VULN-[a-z0-9-]+)$"
    },
    "title": {
      "description": "Short human-readable title.",
      "type": "string",
      "minLength": 8,
      "maxLength": 200
    },
    "description": {
      "description": "Plain-text description of the vulnerability, what causes it, and how it manifests. 2-6 sentences.",
      "type": "string",
      "minLength": 40
    },
    "affected_component": {
      "description": "Primary architectural component affected.",
      "type": "string",
      "enum": [
        "model",
        "fine_tuned_adapter",
        "rag_pipeline",
        "vector_store",
        "embedding_model",
        "agent_framework",
        "plugin_or_tool",
        "inference_server",
        "api_or_sdk",
        "training_pipeline",
        "guardrail_or_filter",
        "browser_assistant",
        "ide_assistant",
        "observability_stack",
        "other"
      ]
    },
    "affected_products": {
      "description": "Concrete products, libraries, or versions affected. Free-text strings; include version ranges where known.",
      "type": "array",
      "items": { "type": "string", "minLength": 1 },
      "minItems": 1
    },
    "dsgai_mapping": {
      "description": "DSGAI risk entries this vulnerability aligns with. Validated against datasets/_shared/dsgai_taxonomy.json.",
      "type": "array",
      "items": {
        "type": "string",
        "enum": [
          "DSGAI01", "DSGAI02", "DSGAI03", "DSGAI04", "DSGAI05",
          "DSGAI06", "DSGAI07", "DSGAI08", "DSGAI09", "DSGAI10",
          "DSGAI11", "DSGAI12", "DSGAI13", "DSGAI14", "DSGAI15",
          "DSGAI16", "DSGAI17", "DSGAI18", "DSGAI19", "DSGAI20", "DSGAI21"
        ]
      },
      "minItems": 1,
      "uniqueItems": true
    },
    "owasp_llm_top10_mapping": {
      "description": "OWASP Top 10 for LLM Applications 2025 entries this vulnerability aligns with.",
      "type": "array",
      "items": {
        "type": "string",
        "enum": [
          "LLM01:2025", "LLM02:2025", "LLM03:2025", "LLM04:2025", "LLM05:2025",
          "LLM06:2025", "LLM07:2025", "LLM08:2025", "LLM09:2025", "LLM10:2025"
        ]
      },
      "uniqueItems": true
    },
    "severity": {
      "description": "Severity rating. CVSS preferred when available; qualitative always required.",
      "type": "object",
      "additionalProperties": false,
      "required": ["qualitative"],
      "properties": {
        "qualitative": {
          "type": "string",
          "enum": ["Critical", "High", "Medium", "Low", "Informational"]
        },
        "cvss_v3_score": {
          "type": "number",
          "minimum": 0.0,
          "maximum": 10.0
        },
        "cvss_v3_vector": {
          "type": "string",
          "pattern": "^CVSS:3\\.[01]/AV:[NALP]/AC:[LH]/PR:[NLH]/UI:[NR]/S:[UC]/C:[NLH]/I:[NLH]/A:[NLH](/.*)?$"
        }
      }
    },
    "cve_id": {
      "description": "Primary CVE ID if any.",
      "type": "string",
      "pattern": "^CVE-\\d{4}-\\d{4,7}$"
    },
    "cwe_ids": {
      "description": "Associated CWE identifiers.",
      "type": "array",
      "items": { "type": "string", "pattern": "^CWE-\\d{1,5}$" },
      "uniqueItems": true
    },
    "source_urls": {
      "description": "Public, citable references. NVD page, advisory, vendor disclosure, research paper, etc. At least one required.",
      "type": "array",
      "items": { "type": "string", "format": "uri" },
      "minItems": 1,
      "uniqueItems": true
    },
    "date_reported": {
      "description": "Date the vulnerability was publicly disclosed (ISO 8601 date).",
      "type": "string",
      "format": "date"
    },
    "date_added": {
      "description": "Date this entry was added to the dataset (ISO 8601 date).",
      "type": "string",
      "format": "date"
    },
    "disclosure_status": {
      "description": "How the issue was made public.",
      "type": "string",
      "enum": ["public_cve", "vendor_advisory", "coordinated_disclosure", "research_publication", "responsible_disclosure", "self_reported"]
    },
    "exploit_available": {
      "description": "Whether public exploit code or a published PoC exists.",
      "type": "string",
      "enum": ["public_poc", "private_poc", "exploited_in_the_wild", "none_known", "unknown"]
    },
    "mitigations": {
      "description": "Short list of recommended mitigations specific to this vulnerability.",
      "type": "array",
      "items": { "type": "string", "minLength": 4 }
    },
    "tags": {
      "description": "Free-form classification tags (e.g., 'prompt-injection', 'ssrf', 'path-traversal', 'rce', 'memory-extraction').",
      "type": "array",
      "items": { "type": "string", "minLength": 2 },
      "uniqueItems": true
    },
    "notes": {
      "description": "Author notes — caveats, scope clarifications, model-specific behavior.",
      "type": "string"
    }
  }
}
