{
  "$schema": "../schema.json",
  "vulnerability_id": "CVE-2023-34540",
  "title": "LangChain JiraAPIWrapper remote code execution",
  "description": "LangChain before 0.0.225 contains an RCE vulnerability in the JiraAPIWrapper (JIRA API wrapper) component. An attacker can pass crafted input to jira.run() that gets evaluated, executing arbitrary code on the host running the chain. The issue stems from passing user-controlled strings into an unsafe evaluator inside the tool wrapper.",
  "affected_component": "plugin_or_tool",
  "affected_products": ["LangChain < 0.0.225"],
  "dsgai_mapping": ["DSGAI06"],
  "owasp_llm_top10_mapping": ["LLM05:2025", "LLM01:2025"],
  "severity": {
    "qualitative": "Critical",
    "cvss_v3_score": 9.8,
    "cvss_v3_vector": "CVSS:3.1/AV:N/AC:L/PR:N/UI:N/S:U/C:H/I:H/A:H"
  },
  "cve_id": "CVE-2023-34540",
  "cwe_ids": ["CWE-94"],
  "source_urls": [
    "https://nvd.nist.gov/vuln/detail/CVE-2023-34540",
    "https://github.com/langchain-ai/langchain/issues/4833",
    "https://github.com/langchain-ai/langchain/pull/6992",
    "https://github.com/langchain-ai/langchain/releases/tag/v0.0.225"
  ],
  "date_reported": "2023-06-14",
  "date_added": "2026-05-18",
  "disclosure_status": "public_cve",
  "exploit_available": "public_poc",
  "mitigations": [
    "Upgrade LangChain to 0.0.225 or later.",
    "Validate and constrain tool-wrapper inputs at the agent layer before dispatch.",
    "Treat third-party API tool wrappers as untrusted code paths and sandbox accordingly."
  ],
  "tags": ["rce", "tool-wrapper", "agent-tool-abuse"]
}
