{
  "$schema": "../schema.json",
  "vulnerability_id": "CVE-2023-29374",
  "title": "LangChain LLMMathChain prompt-injection to arbitrary code execution",
  "description": "LangChain through 0.0.131 contains a prompt-injection vulnerability in the LLMMathChain component. A crafted prompt causes the LLM to emit Python expressions which the chain evaluates via exec, achieving arbitrary code execution on the host. The root cause is treating LLM output as trusted input to a code-execution sink without sandboxing.",
  "affected_component": "agent_framework",
  "affected_products": ["LangChain <= 0.0.131"],
  "dsgai_mapping": ["DSGAI06", "DSGAI05"],
  "owasp_llm_top10_mapping": ["LLM01:2025", "LLM05:2025"],
  "severity": {
    "qualitative": "Critical",
    "cvss_v3_score": 9.8,
    "cvss_v3_vector": "CVSS:3.1/AV:N/AC:L/PR:N/UI:N/S:U/C:H/I:H/A:H"
  },
  "cve_id": "CVE-2023-29374",
  "cwe_ids": ["CWE-74", "CWE-94"],
  "source_urls": [
    "https://nvd.nist.gov/vuln/detail/CVE-2023-29374",
    "https://github.com/langchain-ai/langchain/issues/1026",
    "https://github.com/langchain-ai/langchain/pull/1119"
  ],
  "date_reported": "2023-04-04",
  "date_added": "2026-05-18",
  "disclosure_status": "public_cve",
  "exploit_available": "public_poc",
  "mitigations": [
    "Upgrade to a LangChain release that uses restricted evaluation in place of exec.",
    "Never pass LLM output to a code-execution sink without an isolated sandbox.",
    "Apply allowlists on tool surfaces that can execute code; default-deny."
  ],
  "tags": ["prompt-injection", "rce", "agent-tool-abuse", "code-execution-sink"]
}
