{
  "$schema": "../schema.json",
  "vulnerability_id": "CVE-2023-44467",
  "title": "LangChain Experimental PALChain __import__ bypass to RCE",
  "description": "langchain_experimental from 0.0.14 and before 0.0.306 contains an RCE vulnerability that bypasses the CVE-2023-36258 fix by abusing Python's __import__ builtin, which is not filtered by pal_chain/base.py. A crafted LLM-generated payload uses __import__('os').system(...) (or equivalents) to escape the denylist and execute arbitrary code on the host.",
  "affected_component": "agent_framework",
  "affected_products": ["langchain_experimental >= 0.0.14, < 0.0.306"],
  "dsgai_mapping": ["DSGAI06", "DSGAI05"],
  "owasp_llm_top10_mapping": ["LLM01:2025", "LLM05:2025"],
  "severity": {
    "qualitative": "Critical",
    "cvss_v3_score": 9.8,
    "cvss_v3_vector": "CVSS:3.1/AV:N/AC:L/PR:N/UI:N/S:U/C:H/I:H/A:H"
  },
  "cve_id": "CVE-2023-44467",
  "cwe_ids": ["CWE-94"],
  "source_urls": [
    "https://nvd.nist.gov/vuln/detail/CVE-2023-44467",
    "https://github.com/langchain-ai/langchain/commit/4c97a10bd0d9385cfee234a63b5bd826a295e483"
  ],
  "date_reported": "2023-10-09",
  "date_added": "2026-05-18",
  "disclosure_status": "public_cve",
  "exploit_available": "public_poc",
  "mitigations": [
    "Upgrade langchain_experimental to 0.0.306 or later.",
    "Do not deploy PAL-style chains in production; replace with restricted DSL evaluators.",
    "Audit denylists for completeness — __import__, __builtins__, getattr, type, lambda all need coverage."
  ],
  "tags": ["rce", "pal-chain", "denylist-bypass", "agent-tool-abuse"],
  "notes": "Demonstrates that denylist-based code sandboxes are fragile; a single missed builtin defeats the control. Allowlists are strongly preferred."
}
