{
  "$schema": "../schema.json",
  "vulnerability_id": "DSGAI-VULN-2024-slack-ai-indirect-prompt-injection",
  "title": "Slack AI indirect prompt injection enabling private-channel data exfiltration",
  "description": "Slack AI prior to remediation indexes messages — and as of August 14, 2024, also uploaded documents and Google Drive files — and answers user queries against that index. PromptArmor demonstrated that an attacker posting a crafted message in a public channel could plant indirect instructions that, when surfaced by Slack AI to a victim asking an unrelated question, cause Slack AI to render a markdown link containing data exfiltrated from the victim's private channels in the query string. The attacker need not be a member of the targeted private channel.",
  "affected_component": "agent_framework",
  "affected_products": ["Slack AI (vulnerable pre-fix configuration as of August 2024)"],
  "dsgai_mapping": ["DSGAI01", "DSGAI11", "DSGAI15"],
  "owasp_llm_top10_mapping": ["LLM01:2025", "LLM02:2025"],
  "severity": {
    "qualitative": "High"
  },
  "source_urls": [
    "https://promptarmor.substack.com/p/data-exfiltration-from-slack-ai-via",
    "https://simonwillison.net/2024/Aug/20/data-exfiltration-from-slack-ai/",
    "https://www.theregister.com/2024/08/21/slack_ai_prompt_injection/"
  ],
  "date_reported": "2024-08-20",
  "date_added": "2026-05-18",
  "disclosure_status": "research_publication",
  "exploit_available": "public_poc",
  "mitigations": [
    "Disable rendering of arbitrary external markdown links from LLM output; strip query strings from rendered URLs.",
    "Enforce a strict allowlist of egress domains for any markdown the assistant returns.",
    "Treat any data the assistant can read as in-scope for exfiltration via injection from any other data it can read — design the data plane accordingly."
  ],
  "tags": ["prompt-injection", "indirect-prompt-injection", "cross-context-bleed", "markdown-exfiltration", "saas-llm"],
  "notes": "Canonical illustration of DSGAI11 (Cross-Context & Multi-User Conversation Bleed) caused by an LLM with broader read access than any individual asker."
}
