{
  "$schema": "../schema.json",
  "vulnerability_id": "CVE-2024-0520",
  "title": "MLflow HTTP dataset loader path traversal to RCE",
  "description": "MLflow before 2.9.0 contains a path traversal in the HTTP dataset module. The filename used when persisting a remote dataset is extracted from the Content-Disposition header or URL path without sanitization, allowing an attacker who controls the dataset URL to write arbitrary files (including over executable paths), enabling command execution on the MLflow host.",
  "affected_component": "training_pipeline",
  "affected_products": ["MLflow < 2.9.0"],
  "dsgai_mapping": ["DSGAI04", "DSGAI07"],
  "owasp_llm_top10_mapping": ["LLM03:2025"],
  "severity": {
    "qualitative": "High",
    "cvss_v3_score": 8.8,
    "cvss_v3_vector": "CVSS:3.1/AV:N/AC:L/PR:N/UI:R/S:U/C:H/I:H/A:H"
  },
  "cve_id": "CVE-2024-0520",
  "cwe_ids": ["CWE-22"],
  "source_urls": [
    "https://nvd.nist.gov/vuln/detail/CVE-2024-0520",
    "https://huntr.com/bounties/93e470d7-b6f0-409b-af63-49d3e2a26dbc",
    "https://github.com/mlflow/mlflow/commit/400c226953b4568f4361bc0a0c223511652c2b9d"
  ],
  "date_reported": "2024-06-06",
  "date_added": "2026-05-18",
  "disclosure_status": "public_cve",
  "exploit_available": "public_poc",
  "mitigations": [
    "Upgrade MLflow to 2.9.0 or later.",
    "Only load datasets from a trusted registry or signed manifests.",
    "Run MLflow under a low-privilege user with a read-only application directory."
  ],
  "tags": ["path-traversal", "rce", "training-pipeline", "dataset-supply-chain"]
}
