{
  "$schema": "../schema.json",
  "vulnerability_id": "CVE-2024-6825",
  "title": "LiteLLM post_call_rules callback arbitrary command execution",
  "description": "LiteLLM up to (excluding) 1.65.4 improperly processes callback functions in the post_call_rules configuration. The system splits the configured value at the final period, treating the last segment as a function name and importing the rest as a Python module. An authenticated attacker can configure os.system (or equivalent) as a callback so that arbitrary commands execute whenever a chat response is processed. Because LiteLLM proxies API keys for multiple providers, compromise yields the full set of provider credentials.",
  "affected_component": "agent_framework",
  "affected_products": ["LiteLLM < 1.65.4", "LiteLLM 1.65.4-dev2"],
  "dsgai_mapping": ["DSGAI02", "DSGAI06", "DSGAI17"],
  "owasp_llm_top10_mapping": ["LLM03:2025", "LLM05:2025"],
  "severity": {
    "qualitative": "High",
    "cvss_v3_score": 8.8,
    "cvss_v3_vector": "CVSS:3.0/AV:N/AC:L/PR:L/UI:N/S:U/C:H/I:H/A:H"
  },
  "cve_id": "CVE-2024-6825",
  "cwe_ids": ["CWE-94"],
  "source_urls": [
    "https://nvd.nist.gov/vuln/detail/CVE-2024-6825",
    "https://huntr.com/bounties/1d98bebb-6cf4-46c9-87c3-d3b1972973b5",
    "https://github.com/berriai/litellm/commit/441c7275ed2715f47650a7c2e525055c804073a9"
  ],
  "date_reported": "2025-03-20",
  "date_added": "2026-05-18",
  "disclosure_status": "public_cve",
  "exploit_available": "public_poc",
  "mitigations": [
    "Upgrade LiteLLM to 1.65.4 or later.",
    "Restrict who can write proxy configuration; rotate any provider API keys after upgrade.",
    "Run the LiteLLM proxy on a dedicated host with no developer-shell access; treat config endpoints as RCE-sensitive."
  ],
  "tags": ["rce", "config-injection", "ai-gateway", "credential-exposure"]
}
