{
  "$schema": "../schema.json",
  "vulnerability_id": "CVE-2024-3025",
  "title": "AnythingLLM logo upload path traversal",
  "description": "AnythingLLM before 1.0.0 contains a relative path traversal flaw in /api/system/upload-logo and /api/system/logo. An authenticated low-privilege attacker can manipulate the logo filename to read or delete files outside the intended directory, including configuration files, vector store credentials, and uploaded user documents.",
  "affected_component": "agent_framework",
  "affected_products": ["AnythingLLM < 1.0.0"],
  "dsgai_mapping": ["DSGAI01", "DSGAI02"],
  "owasp_llm_top10_mapping": ["LLM02:2025", "LLM06:2025"],
  "severity": {
    "qualitative": "Critical",
    "cvss_v3_score": 9.9,
    "cvss_v3_vector": "CVSS:3.0/AV:N/AC:L/PR:L/UI:N/S:C/C:H/I:H/A:H"
  },
  "cve_id": "CVE-2024-3025",
  "cwe_ids": ["CWE-23"],
  "source_urls": [
    "https://nvd.nist.gov/vuln/detail/CVE-2024-3025",
    "https://huntr.com/bounties/fb09a352-1016-4481-ae88-7460e2b6062b",
    "https://github.com/mintplex-labs/anything-llm/commit/7de23dbb2da932fbfb39f56d981784d3702cf5ce"
  ],
  "date_reported": "2024-04-10",
  "date_added": "2026-05-18",
  "disclosure_status": "public_cve",
  "exploit_available": "public_poc",
  "mitigations": [
    "Upgrade AnythingLLM to 1.0.0 or later.",
    "Restrict the logo-upload endpoint to admin-only; canonicalize and validate target paths.",
    "Run the application with a read-only filesystem outside the dedicated data directory."
  ],
  "tags": ["path-traversal", "file-read", "credential-exposure"]
}
