{
  "$schema": "../schema.json",
  "vulnerability_id": "CVE-2024-1727",
  "title": "Gradio CSRF allowing large-file uploads and disk exhaustion",
  "description": "Gradio 4.16.0 through 4.19.1 contains a CSRF flaw permitting attackers to coerce a victim's browser into uploading large files to local Gradio instances. Sustained exploitation depletes disk space, denying service. The root cause is missing CSRF protection on file-upload endpoints combined with permissive default CORS for share-mode deployments.",
  "affected_component": "agent_framework",
  "affected_products": ["Gradio >= 4.16.0, <= 4.19.1"],
  "dsgai_mapping": ["DSGAI17"],
  "owasp_llm_top10_mapping": ["LLM10:2025"],
  "severity": {
    "qualitative": "Medium",
    "cvss_v3_score": 4.3,
    "cvss_v3_vector": "CVSS:3.0/AV:N/AC:L/PR:N/UI:R/S:U/C:N/I:N/A:L"
  },
  "cve_id": "CVE-2024-1727",
  "cwe_ids": ["CWE-352"],
  "source_urls": [
    "https://nvd.nist.gov/vuln/detail/CVE-2024-1727",
    "https://huntr.com/bounties/a94d55fb-0770-4cbe-9b20-97a978a2ffff",
    "https://github.com/gradio-app/gradio/commit/84802ee6a4806c25287344dce581f9548a99834a"
  ],
  "date_reported": "2024-03-21",
  "date_added": "2026-05-18",
  "disclosure_status": "public_cve",
  "exploit_available": "public_poc",
  "mitigations": [
    "Upgrade Gradio past 4.19.1.",
    "Set a strict allowed_origins list on Gradio servers.",
    "Cap per-request upload size and per-app disk quota at the container or systemd level."
  ],
  "tags": ["csrf", "dos", "demo-platform"]
}
