{
  "$schema": "../schema.json",
  "vulnerability_id": "DSGAI-VULN-2023-vec2text-embedding-inversion",
  "title": "Vec2Text — black-box reconstruction of source text from embeddings (Morris et al., 2023)",
  "description": "Morris et al. (arXiv 2310.06816) introduced Vec2Text, a method that iteratively reconstructs the original text from an embedding vector without access to the embedding model's parameters. Vec2Text was demonstrated against GTR-base and OpenAI text-embedding-ada-002, recovering approximately 92% of short text and high percentages of first/last/full patient names when applied to GTR-embedded MIMIC-III clinical notes. The result establishes that text embeddings stored in vector databases — including those shared, exported, or leaked — are not a privacy-preserving representation and should be treated as equivalent to the underlying text under DSGAI18 (Inference & Data Reconstruction).",
  "affected_component": "vector_store",
  "affected_products": ["Any vector database storing embeddings of sensitive text (illustrated against GTR-base and OpenAI text-embedding-ada-002)"],
  "dsgai_mapping": ["DSGAI18", "DSGAI13", "DSGAI01"],
  "owasp_llm_top10_mapping": ["LLM02:2025", "LLM06:2025"],
  "severity": {
    "qualitative": "High"
  },
  "source_urls": [
    "https://arxiv.org/abs/2310.06816",
    "https://aclanthology.org/2024.acl-long.422.pdf"
  ],
  "date_reported": "2023-10-10",
  "date_added": "2026-05-18",
  "disclosure_status": "research_publication",
  "exploit_available": "public_poc",
  "mitigations": [
    "Treat stored embeddings as sensitive as the source text; apply the same access controls, encryption, and retention rules.",
    "Apply differential privacy to embeddings of high-sensitivity corpora before storage.",
    "Avoid sharing or exporting embeddings outside the trust boundary of the source data.",
    "Audit vector store access patterns for bulk embedding export; alert on unusual download volumes."
  ],
  "tags": ["embedding-inversion", "vector-store", "training-data-reconstruction", "privacy-attack", "membership-inference-class"]
}
