{
  "$schema": "../schema.json",
  "vulnerability_id": "DSGAI-VULN-2023-chatgpt-divergence-extraction",
  "title": "Scalable training-data extraction from ChatGPT via divergence attack (Nasr, Carlini et al., 2023)",
  "description": "Nasr, Carlini, et al. (arXiv 2311.17035) demonstrated extractable memorization at scale across open, semi-open, and closed production LLMs. A 'divergence attack' caused aligned ChatGPT to abandon its chatbot persona and emit verbatim training data at roughly 150x the baseline rate, surfacing several megabytes of training content — including PII, source code, and copyrighted text — for about $200 in API spend. The work shows that RLHF alignment does not eliminate memorization, and that production aligned models remain vulnerable to extractable-data attacks at very low cost.",
  "affected_component": "model",
  "affected_products": ["OpenAI ChatGPT (gpt-3.5-turbo at time of disclosure)", "Pythia, GPT-Neo, LLaMA, Falcon (as additional study targets)"],
  "dsgai_mapping": ["DSGAI01", "DSGAI18"],
  "owasp_llm_top10_mapping": ["LLM02:2025", "LLM06:2025"],
  "severity": {
    "qualitative": "High"
  },
  "source_urls": [
    "https://arxiv.org/abs/2311.17035",
    "https://not-just-memorization.github.io/extracting-training-data-from-chatgpt.html"
  ],
  "date_reported": "2023-11-28",
  "date_added": "2026-05-18",
  "disclosure_status": "research_publication",
  "exploit_available": "public_poc",
  "mitigations": [
    "Apply differential privacy during training to statistically limit memorization of rare records.",
    "Run membership-inference and extractable-memorization audits before deployment; track results over time.",
    "Add output filters for high-recall regurgitation patterns (long verbatim spans, structured PII).",
    "Treat fine-tuning data as the highest-risk corpus — adapters memorize rare examples disproportionately."
  ],
  "tags": ["training-data-extraction", "memorization", "alignment-bypass", "membership-inference", "divergence-attack"],
  "notes": "Foundational reference for DSGAI01 and DSGAI18; the divergence-attack family informs every memorization-related control in the DSGAI taxonomy."
}
