{
  "$schema": "../schema.json",
  "vulnerability_id": "CVE-2024-31621",
  "title": "Flowise authentication bypass via API path case manipulation",
  "description": "FlowiseAI Flowise up to 1.6.5 implements its authentication check with a case-sensitive comparison on the /api/v1 path prefix. Requests sent to upper- or mixed-case variants (e.g. /API/V1/...) bypass authentication entirely, granting full administrative access to chatflow definitions, stored credentials, and any code-execution surfaces exposed by configured nodes — effectively reaching arbitrary code execution.",
  "affected_component": "agent_framework",
  "affected_products": ["FlowiseAI Flowise <= 1.6.5"],
  "dsgai_mapping": ["DSGAI02", "DSGAI06"],
  "owasp_llm_top10_mapping": ["LLM05:2025"],
  "severity": {
    "qualitative": "High",
    "cvss_v3_score": 7.6,
    "cvss_v3_vector": "CVSS:3.1/AV:N/AC:L/PR:L/UI:N/S:U/C:L/I:H/A:L"
  },
  "cve_id": "CVE-2024-31621",
  "cwe_ids": ["CWE-287", "CWE-178"],
  "source_urls": [
    "https://nvd.nist.gov/vuln/detail/CVE-2024-31621",
    "https://www.exploit-db.com/exploits/52001",
    "https://www.invicti.com/web-application-vulnerabilities/flowise-authentication-bypass-cve-2024-31621"
  ],
  "date_reported": "2024-04-29",
  "date_added": "2026-05-18",
  "disclosure_status": "public_cve",
  "exploit_available": "public_poc",
  "mitigations": [
    "Upgrade Flowise to 1.6.6 or later.",
    "Rotate all credentials stored in chatflow nodes after upgrade; assume any pre-upgrade secret is compromised.",
    "Place Flowise behind an authenticated reverse proxy that normalizes path casing."
  ],
  "tags": ["authentication-bypass", "low-code-llm", "case-sensitivity"]
}
