{
  "$schema": "../schema.json",
  "vulnerability_id": "CVE-2023-6014",
  "title": "MLflow unauthenticated account creation",
  "description": "MLflow exposes an authentication path that allows an unauthenticated remote attacker to arbitrarily create accounts, bypassing the intended access control on the tracking server. Once an account exists, the attacker has full read/write access to experiments, models, and artifacts — i.e., the entire ML data plane the MLflow instance manages.",
  "affected_component": "training_pipeline",
  "affected_products": ["MLflow (all versions prior to fix per huntr advisory)"],
  "dsgai_mapping": ["DSGAI02", "DSGAI04"],
  "owasp_llm_top10_mapping": ["LLM03:2025"],
  "severity": {
    "qualitative": "Critical",
    "cvss_v3_score": 9.8,
    "cvss_v3_vector": "CVSS:3.1/AV:N/AC:L/PR:N/UI:N/S:U/C:H/I:H/A:H"
  },
  "cve_id": "CVE-2023-6014",
  "cwe_ids": ["CWE-598", "CWE-287"],
  "source_urls": [
    "https://nvd.nist.gov/vuln/detail/CVE-2023-6014",
    "https://huntr.com/bounties/3e64df69-ddc2-463e-9809-d07c24dc1de4"
  ],
  "date_reported": "2023-11-16",
  "date_added": "2026-05-18",
  "disclosure_status": "public_cve",
  "exploit_available": "public_poc",
  "mitigations": [
    "Upgrade MLflow to the fixed release.",
    "Front the MLflow tracking server with an authenticated reverse proxy; do not rely on built-in auth alone for internet-facing deployments.",
    "Audit existing accounts and rotate credentials after upgrade."
  ],
  "tags": ["authentication-bypass", "training-pipeline", "credential-exposure"]
}
