{
  "$schema": "../schema.json",
  "vulnerability_id": "CVE-2024-3568",
  "title": "Hugging Face transformers load_repo_checkpoint pickle deserialization RCE",
  "description": "huggingface/transformers before 4.38.0 contains a deserialization vulnerability in load_repo_checkpoint(). The function calls pickle.load on attacker-influenced checkpoint files without restriction, enabling arbitrary code execution when a victim loads a crafted checkpoint repository. This is the canonical 'load a pickled model and get pwned' supply-chain attack against the Hugging Face hub.",
  "affected_component": "model",
  "affected_products": ["huggingface/transformers < 4.38.0"],
  "dsgai_mapping": ["DSGAI04", "DSGAI20"],
  "owasp_llm_top10_mapping": ["LLM03:2025"],
  "severity": {
    "qualitative": "Critical",
    "cvss_v3_score": 9.6,
    "cvss_v3_vector": "CVSS:3.1/AV:N/AC:L/PR:N/UI:R/S:C/C:H/I:H/A:H"
  },
  "cve_id": "CVE-2024-3568",
  "cwe_ids": ["CWE-502"],
  "source_urls": [
    "https://nvd.nist.gov/vuln/detail/CVE-2024-3568",
    "https://huntr.com/bounties/b3c36992-5264-4d7f-9906-a996efafba8f",
    "https://github.com/huggingface/transformers/commit/693667b8ac8138b83f8adb6522ddaf42fa07c125"
  ],
  "date_reported": "2024-04-10",
  "date_added": "2026-05-18",
  "disclosure_status": "public_cve",
  "exploit_available": "public_poc",
  "mitigations": [
    "Upgrade transformers to 4.38.0 or later.",
    "Prefer safetensors over pickle-based checkpoints for any third-party model.",
    "Scan downloaded checkpoints with picklescan or model-scanning tooling before load.",
    "Pin model sources to an internal mirror with provenance verification."
  ],
  "tags": ["deserialization", "rce", "model-supply-chain", "pickle"]
}
