{
  "$schema": "../schema.json",
  "vulnerability_id": "CVE-2023-39631",
  "title": "LangChain numexpr evaluate() arbitrary code execution",
  "description": "LangChain 0.0.245 permits remote attackers to achieve arbitrary code execution by exploiting the numexpr library's evaluate function. The chain forwards LLM-generated math expressions to numexpr.evaluate without restricting the allowed namespace, enabling Python expression evaluation that breaks out of the math sandbox and runs arbitrary code on the host.",
  "affected_component": "agent_framework",
  "affected_products": ["LangChain 0.0.245", "numexpr (when used as a math executor by LangChain)"],
  "dsgai_mapping": ["DSGAI06", "DSGAI05"],
  "owasp_llm_top10_mapping": ["LLM01:2025", "LLM05:2025"],
  "severity": {
    "qualitative": "Critical",
    "cvss_v3_score": 9.8,
    "cvss_v3_vector": "CVSS:3.1/AV:N/AC:L/PR:N/UI:N/S:U/C:H/I:H/A:H"
  },
  "cve_id": "CVE-2023-39631",
  "cwe_ids": ["CWE-94"],
  "source_urls": [
    "https://nvd.nist.gov/vuln/detail/CVE-2023-39631",
    "https://github.com/langchain-ai/langchain/issues/8363",
    "https://github.com/pydata/numexpr/issues/442"
  ],
  "date_reported": "2023-09-01",
  "date_added": "2026-05-18",
  "disclosure_status": "public_cve",
  "exploit_available": "public_poc",
  "mitigations": [
    "Upgrade past 0.0.245 and pin numexpr to a version that restricts its evaluation namespace.",
    "Whitelist the allowed math operators and reject any input containing dunder attributes (__import__, __builtins__, etc.).",
    "Treat math executors as untrusted code paths and run them out-of-process with restricted privileges."
  ],
  "tags": ["rce", "math-chain", "numexpr", "sandbox-escape"]
}
