{
  "$schema": "../schema.json",
  "vulnerability_id": "CVE-2024-5826",
  "title": "Vanna AI prompt-injection RCE via vanna.ask",
  "description": "vanna-ai/vanna exposes a prompt-injection-driven RCE through the vanna.ask function. The LLM-generated Python used to render charts is executed without sandboxing, so a crafted user question (or a poisoned training prompt) produces code that runs on the host. This is the canonical natural-language analytics-to-RCE pattern.",
  "affected_component": "agent_framework",
  "affected_products": ["vanna-ai/vanna (vulnerable versions prior to the huntr-disclosed fix)"],
  "dsgai_mapping": ["DSGAI06", "DSGAI12", "DSGAI05"],
  "owasp_llm_top10_mapping": ["LLM01:2025", "LLM05:2025"],
  "severity": {
    "qualitative": "Critical",
    "cvss_v3_score": 9.8,
    "cvss_v3_vector": "CVSS:3.0/AV:N/AC:L/PR:N/UI:N/S:U/C:H/I:H/A:H"
  },
  "cve_id": "CVE-2024-5826",
  "cwe_ids": ["CWE-94"],
  "source_urls": [
    "https://nvd.nist.gov/vuln/detail/CVE-2024-5826",
    "https://huntr.com/bounties/90620087-44ac-4e43-b659-3c5d30889369"
  ],
  "date_reported": "2024-06-27",
  "date_added": "2026-05-18",
  "disclosure_status": "public_cve",
  "exploit_available": "public_poc",
  "mitigations": [
    "Upgrade vanna past the disclosed fix; disable LLM-generated code execution if not strictly required.",
    "Render charts in a separate sandbox (Docker, Firecracker) with no DB or filesystem access.",
    "Treat NL-to-analytics tools as nl-to-RCE primitives until proven sandboxed end-to-end."
  ],
  "tags": ["rce", "prompt-injection", "nl-to-analytics", "agent-tool-abuse"]
}
