{
  "$schema": "../schema.json",
  "vulnerability_id": "CVE-2023-36258",
  "title": "LangChain PALChain arbitrary code execution via Python exec",
  "description": "LangChain before 0.0.236 allows an attacker to achieve arbitrary code execution through PALChain. The chain accepts LLM-generated Python and runs it via os.system, exec, or eval without sandboxing or denylisting these sinks. A crafted prompt produces a payload program that executes on the host.",
  "affected_component": "agent_framework",
  "affected_products": ["LangChain <= 0.0.199"],
  "dsgai_mapping": ["DSGAI06", "DSGAI05"],
  "owasp_llm_top10_mapping": ["LLM01:2025", "LLM05:2025"],
  "severity": {
    "qualitative": "Critical",
    "cvss_v3_score": 9.8,
    "cvss_v3_vector": "CVSS:3.1/AV:N/AC:L/PR:N/UI:N/S:U/C:H/I:H/A:H"
  },
  "cve_id": "CVE-2023-36258",
  "cwe_ids": ["CWE-94"],
  "source_urls": [
    "https://nvd.nist.gov/vuln/detail/CVE-2023-36258",
    "https://github.com/langchain-ai/langchain/issues/5872"
  ],
  "date_reported": "2023-07-03",
  "date_added": "2026-05-18",
  "disclosure_status": "public_cve",
  "exploit_available": "public_poc",
  "mitigations": [
    "Upgrade LangChain to 0.0.236 or later.",
    "Remove PALChain from production agent surfaces unless a strict, sandboxed executor is in place.",
    "Apply denylists on dangerous builtins (os.system, exec, eval, __import__) at the executor boundary."
  ],
  "tags": ["rce", "pal-chain", "agent-tool-abuse", "code-execution-sink"],
  "notes": "This fix was subsequently bypassed by CVE-2023-44467 via __import__."
}
